[
  {
    "id": "affix.suffix.long_nights",
    "name": "of Long Nights",
    "slot": "suffix",
    "appliesTo": ["weapon.melee", "weapon.ranged"],
    "tiers": [
      { "weight": 100, "modifiers": [{ "stat": "swing_stamina", "op": "mul", "value": 0.88 }] },
      { "weight": 40, "modifiers": [{ "stat": "swing_stamina", "op": "mul", "value": 0.78 }] },
      { "weight": 10, "modifiers": [{ "stat": "swing_stamina", "op": "mul", "value": 0.65 }] }
    ]
  },
  {
    "id": "affix.suffix.salvage",
    "name": "of Salvage",
    "slot": "suffix",
    "appliesTo": ["weapon.melee", "weapon.ranged", "armor", "container"],
    "tiers": [
      { "weight": 100, "modifiers": [{ "stat": "repair_cost", "op": "mul", "value": 0.8 }] },
      { "weight": 40, "modifiers": [{ "stat": "repair_cost", "op": "mul", "value": 0.65 }] },
      { "weight": 10, "modifiers": [{ "stat": "repair_cost", "op": "mul", "value": 0.45 }] }
    ]
  },
  {
    "id": "affix.suffix.ruin",
    "name": "of Ruin",
    "slot": "suffix",
    "appliesTo": ["weapon.melee", "weapon.ranged"],
    "tiers": [
      {
        "weight": 100,
        "modifiers": [
          { "stat": "melee_damage", "op": "mul", "value": 1.3 },
          { "stat": "condition_loss", "op": "mul", "value": 2.0 }
        ]
      },
      {
        "weight": 40,
        "modifiers": [
          { "stat": "melee_damage", "op": "mul", "value": 1.5 },
          { "stat": "condition_loss", "op": "mul", "value": 2.8 }
        ]
      }
    ]
  },
  {
    "id": "affix.suffix.deep_pockets",
    "name": "of Deep Pockets",
    "slot": "suffix",
    "appliesTo": ["container", "armor"],
    "tiers": [
      { "weight": 100, "modifiers": [{ "stat": "carry_capacity", "op": "add", "value": 3 }] },
      { "weight": 40, "modifiers": [{ "stat": "carry_capacity", "op": "add", "value": 6 }] },
      { "weight": 10, "modifiers": [{ "stat": "carry_capacity", "op": "add", "value": 10 }] }
    ]
  }
]
